date;id;text;views.count;likes.count;reposts.count;type;link;post_id;parents_stack
2020-06-29 14:14:11;22125;"Надо ещё % явки.
Мой прогноз (методом 3П - пол, палец, потолок) 71% по стране,  68% по СПб.
Сам уже сделал свой скромный вброс ""за"" в воскресенье😉";;1;;comment;;22121.0;
2020-06-29 14:18:58;22127;[id3374040|Артем], плохо что нет дистанционки, скорее всего не успею приехать;;0;;reply;;22121.0;22125
2020-06-29 14:25:57;22129;[id3374040|Артем], процент будет высоким более 70;;1;;reply;;22121.0;22125
2020-07-02 06:57:42;22137;"[id3374040|Артем], надо быть упоротым или напрочь отбитым, чтобы проголосовать за то, что уже и так есть в федеральных законах. Большинство голосующих ""ЗА"" даже поправки в глаза не видели, только красивые картинки и лозунги на них, как же ох№енно станет жить в нашей стране. По факту ничего не изменится. И сутью является не ср@ное обнуление, а тупо возможность уйти в сенаторы и получить пожизненную неприкосновенность.";;0;;reply;;22121.0;22125
2020-07-02 10:38:21;22152;"[id1153790|Александр], я очень предвзят. 
Если мастера протеста Резник, Вишневский и помельче типа Врански, Бакан, Кушнаренко (и т.д.) ""против"".
Значит, я буду ""за"".";;1;;reply;;22121.0;22125
2020-07-02 10:46:33;22153;"[id3374040|Артем], так Вы делаете это не им назло, а своим родным, знакомым, соседям. 
Вместо того, чтобы прочитать все поправки и понять суть и взвешенно принять решение вне зависимости от позиции нелюбимых Вами людей, Вы слепо идёте на поводу у своих принципов.";;0;;reply;;22121.0;22125
2020-07-02 10:55:21;22154;"[id1153790|Александр], для себя я принял решение. Потом выполнил это принятое решение. Мои мотивы такие - какие есть, не самые худшие, на мой взгляд.
Скулеж всяких яблочников, навальнят, ходорвоинов и прочих примкнувших к оным мне нравится.
P.S. Мои родные и знакомые сделали аналогичный моему выбор.";;2;;reply;;22121.0;22125
2020-07-02 10:59:31;22155;[id3374040|Артем], Выбор, который никто не может аргументировать и объяснить полезные вытекающие свойства от внесения этих поправок.;;0;;reply;;22121.0;22125
2020-07-02 18:09:02;22161;[id1153790|Александр], 😊;;0;;reply;;22121.0;22125
2020-07-02 06:59:23;22138;"Кретины, голосующие ""ЗА"", даже не понимают, что часть принимаемых поправок противоречит первым двум главам Конституции, но ватникам не до этого, они тут за волонтерство , кошечек и мрот голосуют.";;1;;comment;;22121.0;
2020-06-29 09:52:50;22114;"Какая феерия бреда. Главное отличие в том, что у тех, кто за ""сильную страну"" было 20 лет. У них было дохрена времени сделать нам хорошо. Не вышло. Дайте теперь другим попробовать. Или что? Вам конституция мешала?";;5;;comment;;22113.0;
2020-07-02 18:11:19;22162;[id1097091|Сергей], 😊;;0;;reply;;22113.0;22114
2020-06-29 10:28:13;22115;"Сравнение мундепов с троцкистами любопытно. 
Аксаков - товарищ Сталин? Шедеврально 😄👏
Только не закончатся мундепы после поправок, так и останутся до новых муниципальных выборов.
И поводы для нового хайпа всегда найдутся.";;4;;comment;;22113.0;
2020-06-29 10:45:57;22116;Тов. Аксаков уже приготовил ледоруб?;;3;;comment;;22113.0;
2020-06-29 12:37:56;22119;[id4386035|Руслан], автор жжёт✌;;0;;reply;;22113.0;22116
2020-06-29 12:38:44;22120;[id4386035|Руслан], за нами уже выехали...  :)  Вот только история ничему не учит.....   тов. Сталин первым делом сгноил своих политических единомышленников....;;1;;reply;;22113.0;22116
2020-06-29 14:05:55;22123;[id1908905|Владимир], как тебе сравнение со Сталиным? Не посчитал оскорблением?;;0;;reply;;22113.0;22116
2020-06-29 11:00:26;22117;Мнда..... Вам бы вместе с ВВП псевдоисторические статьи писать.... Над которыми студенты - первоки истфака ржут громко и долго. Эдак скоро договоритесь до того, что Прибалтийские республики добровольно в состав СССР вошли, а их законное правительство (которое кстати вместе семьями гнило в Сибири) продолжало управлять странами. Польша с Финляндией напали на СССР, тупые самоубийцы.... А Кавказские народы тов. Сталин никуда не переселял..... Что касаемо Троцкого.... Одно из двух. Либо Вы черпаете знания из учебника истории СССР, либо на этом мысли заканчиваются Когда Троцкий делал революцию (заметьте, о тов. Сталине , мелком уголовнике, который промышлял грабежами во имя револяции вообще никто не знал. ) У Троцкого была харизма, образование, и он был действующим военным, собственно спасшим Большивиков от поражения в Гражданской войне. Революцию делал не Ленин, а Троцкий. Тов. Ленин прибыл в Петроград когда уже все было готово. А тов. Сталин после смерти Ленина, убрал всех революционепрв, обезглавил армию (Блюхера напр...., оставив только лоялных, и бездарных людей себе людей в своем окружении (Тухачевский напр.). Вот тут хорошая параллель с кооперативом Озеро, охранниками и повораами одного автократа..... Кстати было не две силы.... Скорее Бльшивики, Меньшивики, собственно ЗАКОННОЕ учредительное собрание, которое было уничтожено Большивиками. Параллелий там много, тут соглашусь, Да только в НЕВЫДУМАННОЙ истории. Кстати, о Троцком действительно мало знают. Его имя было забыто в. Вырвывали страницы из учебника истории с врагами народа, закрашивали их портреты. Дак у нас и про переселение Кавказских, ПРибалтийских народов как-то не принято вспоминать, и понятие ВОВ ввели, что-бы дата вступления СССР во вторую мировую бвла не 1939 год, и не с нападения на Польшу, на стороне Фашисткой Германии. Да и и где Гитлеровские войска учились перед второй мировой, тоже как-то не очень хочется вспоминать. И про то, кто проектировал Днепроэс, магнитку, и пр, и чем расплачивались за это.....;;2;;comment;;22113.0;
2020-06-28 01:14:29;22108;А что плохого? Я-бы тоже такую футболку одел. Агитация разрешена. Дня тишины не предусмотрено. Когда все парадные были увешаны рекламой от партии жуликов и воров, это нормально. Когда по ящику только ЗА это тоже нормально. А как только против - это плохо. В чем проблема то? В стаде военные, которых насильно сгоняют на выборы, бюджетники, которых заставляют голосовать. А эти как раз в меньшинстве, проявляя свою гражданскую позицию против автократии.;;5;;comment;;22102.0;
2020-06-28 16:34:53;22110;Кстати вот реальный расклад голосов по Моркве https://www.youtube.com/watch?time_continue=908&v=29B-gpPJr4Q&feature=emb_logo;;0;;comment;;22102.0;
2020-07-01 19:07:41;22134;"Футболочки  актуальны. Вот мужчина справа в не чищенных, грязных туфлях  своей неопрятностью проявил неуважение к дамам. 
Замечу, мужчины на фото с этикетом явно не знакомы.";;0;;comment;;22102.0;
2020-06-27 12:19:45;22078;Не понял претензий к мундепам. Ничего конкретного, никаких фактов. А то, что некоторые депутаты имеют гражданскую позицию является только благом.;;3;;comment;;22077.0;
2020-06-27 12:57:11;22081;[id4386035|Руслан], прислал неравнодушный житель.;;0;;reply;;22077.0;22078
2020-06-27 13:47:07;22087;[club189579374|Гражданка Общественный Совет], это просто гавканье на мундепов без причины. У любого органа власти есть ошибки и косяки. Их можно подсвечивать. А пустые нападки могут навести на мысль, что реальных грехов не нашли.;;4;;reply;;22077.0;22078
2020-06-27 12:29:34;22079;Я вот тоже не понял, что  не так? Эти поправки ставят нас в один ряд с Бурунди и Буркина-Фасо. Любому адекватному человеку это очевидно.;;6;;comment;;22077.0;
2020-06-27 12:59:11;22082;[id1097091|Сергей], не все так думают, поправки в целом полезные. Но здесь вопрос что голосовать оптом возможно и не очень правильно.;;0;;reply;;22077.0;22079
2020-06-27 13:12:26;22083;[club189579374|Гражданка Общественный Совет], все полезное реализуется законами и подзаконными актами. Основное ради чего это затевается это обнуление сроков солнцеликого. Никакой другой смысловой нагрузки это не несёт.;;2;;reply;;22077.0;22079
2020-06-27 13:30:05;22084;[id1097091|Сергей], есть понимание что придет другой и будет хорошо?;;0;;reply;;22077.0;22079
2020-06-27 13:37:15;22085;[id1908905|Владимир], безусловно. Это подтверждается историей. Только обязательная сменяемость власти может дать положительный результат. Правитель не должен быть охреневшим от своих полномочий и безнаказанности. Я считаю, что необходимо вернуть 4 года и максимум два срока. И естественно сделать реально независимые суды. Или парламентскую республику.;;5;;reply;;22077.0;22079
2020-06-27 13:52:27;22088;[club189579374|Гражданка Общественный Совет], голосовать оптом это совершенно неправильно и незаконно.  К тому же единственное, что нужно Кремлю, это усиление вечной власти. Остальные поправки не имеют смысла, они уже есть в Конституции или в ФЗ. Их надо просто исполнять.;;4;;reply;;22077.0;22079
2020-06-27 14:24:59;22089;[id1097091|Сергей], на самом деле не требуется ограничения количества сроков, нужен просто честный подсчет голосов. Но если смотреть на США то там обычно всего 2 заранее согласованных кандидата)));;0;;reply;;22077.0;22079
2020-06-27 14:26:49;22091;[id1908905|Владимир], нужно ограничение. Как минимум для того, чтобы не сомневаться в подсчёте голосов.;;1;;reply;;22077.0;22079
2020-06-27 14:30:45;22092;[id1097091|Сергей], для такой огромной страны подсчет голосов это самое слабое место, местечковые голосования могут давать непредсказуемый результат;;0;;reply;;22077.0;22079
2020-06-27 14:31:48;22093;[id4386035|Руслан], согласен на 💯, необходимо было голосовать блоками и необходимо было корректировать 1 главу;;1;;reply;;22077.0;22079
2020-06-27 14:50:28;22094;[id1908905|Владимир], в США вообще система специфичная. И они не образец демократии. Зато там сильное гражданское общество и общественные организации. Даже  слишком. А у нас наоборот, гражданское общество уничтожено.;;1;;reply;;22077.0;22079
2020-06-27 14:52:03;22095;[id1908905|Владимир], сделано так, как выгодно партии вечной власти Путина. Всё это обман и профанация, юридически не значима.;;1;;reply;;22077.0;22079
2020-06-27 14:59:13;22096;[id1908905|Владимир], в наших реалиях очень даже предсказуемо.;;0;;reply;;22077.0;22079
2020-06-27 15:33:12;22097;А зачем такая спешка? В разгар пандемии? Т.е. члены комиссии потенциальные смертники. А знаете для чего? Осенью может быть поздно. Уже сейчас Путина только ленивый не ругает и не смеется над ним. Холодильник побеждает телевизор. А осенью и снести могут.... Другое дело, что ПУ нужно псевдопризнание. Элиты почувствовали что он хромая утка..;;2;;reply;;22077.0;22079
2020-06-27 15:39:03;22098;Вы рубите сук на котором сидите (ЕДРО). Если устроить честные выборы, то партию жуликов и воров вместе с ПУ снесут в одночасье. Народу надоели воры. Вот смотрите напр. то в моем районе делается.... Там жулик у власти давно уже. https://www.youtube.com/watch?time_continue=1&v=YdflNOAiHVU&feature=emb_logo Путину, как автократу нужны не те кто хорошо делает свою работу, а тот кто лоялен. Поэтому и назначает на ключевые ставки поворов, массажистов, охранников.;;0;;reply;;22077.0;22079
2020-06-27 18:18:35;22100;[id210281807|Mihail], я думаю что если хорошо присмотреться то и  данное видео про новых депутатов МО Гражданка тоже пойдет, только требуется редакция небольшая. Хотя надо присмотреться ещё годик, дабы не обвинять голословно, но предпосылки уже есть.;;0;;reply;;22077.0;22079
2020-06-29 12:35:38;22118;Назовите мне пожалуйста независимого депутата с уголовной судимостью и недвижкой на сотни миллионов в центре города. Или с домиком для улочки и виноградниками в Италии.;;0;;reply;;22077.0;22079
2020-07-01 20:11:13;22136;[id1908905|Владимир], а есть пример хоть одной страны, где кто-то сидит у власти без смены и там хорошо?;;0;;reply;;22077.0;22079
2020-07-02 10:09:10;22141;[id113050|Алексей], возможно Ливия при Каддафи? А если философски подходить то как бы ни было хорошо, всегда будут недовольные.;;0;;reply;;22077.0;22079
2020-07-02 10:23:54;22143;"[id1908905|Владимир], ну если для тебя страна, живущая по законам Шариата это пример ""хорошо"", то у нас просто разное понимание этого слова.";;0;;reply;;22077.0;22079
2020-07-02 10:27:16;22144;[id113050|Алексей], тогда вот тебе светское государство Сирия;;0;;reply;;22077.0;22079
2020-07-02 10:28:17;22145;[id1908905|Владимир], все примеры будут про страны третьего мира?;;0;;reply;;22077.0;22079
2020-07-02 10:31:04;22146;Беларусь?;;0;;reply;;22077.0;22079
2020-07-02 10:32:09;22147;[id1908905|Владимир], ну это для ностальгирующих по ссср;;0;;reply;;22077.0;22079
2020-07-02 10:33:14;22149;[id113050|Алексей], приведи свой;;0;;reply;;22077.0;22079
2020-07-02 10:36:16;22151;[id1908905|Владимир], нет таких примеров. Все развитые страны давно уже пережили монархии;;0;;reply;;22077.0;22079
2020-07-02 11:32:53;22157;[id113050|Алексей], мне нравится как устроена государственность Швейцарии;;0;;reply;;22077.0;22079
2020-07-02 11:34:57;22158;[id113050|Алексей], но ты то СССР не видел? А я видел как раз развал и беспредел, в 1993 году приехал в СПб учиться , из моногорода и видел как там все попили и разворовали известные аллигархи которые сейчас скрываются за границей;;0;;reply;;22077.0;22079
2020-07-03 10:22:01;22163;[id1908905|Владимир], Т.е. Вы серьезно считаете что на 100 миллионов человек не найдется ни одного человека, с экономическим образованием, или хорошего менеджера, способного собрать вокруг себя команду люде не по принципу кто лоялен, тот и рулит, а по эффиктивности? И начать выталкивать страну из экономической пропасти?;;0;;reply;;22077.0;22079
2021-08-29 12:26:57;22371;[id210281807|Mihail], такой человек либо приспосабливается, либо выкидывается из карьерной лестницы. На уровне района таких уже нет;;0;;reply;;22077.0;22079
2020-06-27 13:45:37;22086;"Аналогично Руслану не понял сути претензий к депутатам🤷‍♂️ 
Может автор в последствии пояснит? Новым постом, например.";;3;;comment;;22077.0;
2020-06-27 14:25:44;22090;[id3374040|Артем], будем ждать, я более нeпишу посты, только модерирую.;;1;;reply;;22077.0;22086
2020-06-27 18:13:05;22099;"Какой же трусливой собакой надо быть, чтобы отправлять посты анонимно?
По факту ничего не сказано. Что хотели сказать, тоже непонятно. Зато обязательно нагнать на ребят, которые и календарный год еще не отработали. 
Если опять тут разговор о поправках, то только конченый путиноид будет голосовать за это дepьмo. 
Нет поправкам!";;5;;comment;;22077.0;
2020-06-27 18:21:17;22101;[id1153790|Александр], если ты думаешь что это я написал, то я всегда все пишу со своей подписью, но у группы есть стеснительные подписчики...;;1;;comment;;22077.0;
2020-06-27 19:05:15;22103;[id1908905|Владимир], согласись, что эти стеснительные подписчики часто пишут пургу...;;2;;reply;;22077.0;22101
2020-06-27 19:09:52;22104;[id1908905|Владимир], нет, я уверен, что это не ты написал. Я просто не понимаю чего бояться-то?);;0;;reply;;22077.0;22101
2020-06-27 21:25:00;22105;[id4386035|Руслан], скажем так не совсем проработан материал, или же копируют  оппозицию;;0;;reply;;22077.0;22101
2020-06-27 21:28:10;22106;[id1153790|Александр], многие по разным причинам не хотят публичной огласки, а так вдруг это твой однопартиец, развлекается или наоборот создаёт инфошум, таким образом привлекает внимание к персонам выше. Медийности не хватает, а тут хоть и группа маленькая но тематическая.;;0;;reply;;22077.0;22101
2020-06-27 22:34:34;22107;"[id1908905|Владимир], мой однопартиец? Я не состою и никогда не состоял ни в одной из партий.
В данном случае какой-то объект полил грязью людей и пожелал остаться анонимом. Я-то прекрасно знаю, что администрация данного паблика в курсе о том, кто прислал новость, а публикуя подобный контент означает одно - единомыслие администраторов группы с объектом, который кинул в предложку этот пост.";;1;;reply;;22077.0;22101
2020-06-28 19:44:47;22111;[id1908905|Владимир], скажем иначе, материал не проработан совсем. Может это мундепы сами про себя шутят? Ведь на компромат никаким образом не тянет.;;0;;reply;;22077.0;22101
2020-06-29 05:41:27;22112;[id4386035|Руслан], возможно и так, медийку поднимают или же отвлекают внимание;;1;;reply;;22077.0;22101
2020-07-01 20:04:51;22135;"Очередная масса гумуса под видом ""анонимного подписчика"". Аксаков уже был замечен за тем, что писал посты от имени мундепов от ЕдРа. Тут что-то похожее";;2;;comment;;22077.0;
2020-07-15 14:17:45;22189;[id113050|Алексей], гумус это пишу не я да и в группу захожу редко, но ещё есть активные же жители. По постам от ер якобы - это были мои визиты к депутатам и я честно про это написал, но ваши публиковать не стали. Как то однобоко.;;0;;reply;;22077.0;22135
