date;id;text;views.count;likes.count;reposts.count;type;link;post_id;parents_stack
2020-05-12 12:52:26;21932;[id1622246|Наталья], полностью поддерживаем вас, но и мнение подписчиков не игнорируем. Здесь проблема в том что на Гражданке работают волонтеры от ЕР и команда от Амосова (чья листовка), и они конкурируют друг с другом, уничтожая листовки, что является абсурдом. Вместо того чтобы объединится и действовать единым фронтом, ходят и зачищают листовки друг друга.;;1;;reply;;21930.0;21931
2020-05-13 13:55:26;21941;Согласна. В данный момент надо объединиться или хотя бы не мешать друг другу. Но вот Анастасию не могу представить себе срывающей листовку. А волонтеров ЕР могу! они этим перед выборами занимались, опыт есть.;;2;;reply;;21930.0;21931
2020-05-14 08:24:20;21948;[id1622246|Наталья], данные депутаты шедшие по 47 округу от Справедливой России и Яблока срывали лично мои листовки с маниакальных постоянством, лично несколько действующих депутатов и их помощников поймал за руку прямо в момент отрывания, не один раз звонил помощникам Амосова с просьбой не трогать мои листовки, он ни мне обещали но на следующий день все повторялось, ФИО героев не пишу вы их можете посмотреть на сайте МО, претензий нет к Сафонову, так как я лично сам не сорвал ни одной. Так же они как и ЕР заклеивали сверху. Поэтому для меня все они едины и совесть отсутствует не зависимо от партийной принадлежности.;;0;;reply;;21930.0;21931
2020-05-12 12:59:06;21933;Вот это предъява);;2;;comment;;21930.0;
2020-05-12 15:52:13;21934;Депутаты ещё углекислый газ выдыхают, чем приносят вред планете, неся глобальное потепление! Наш российский суд точно с этим разберётся! Наконец-то общественный совет вскрыл опаснейшую  банду расклейщиков!;;2;;comment;;21930.0;
2020-05-13 11:29:02;21936;А высокооплачиваемые расклейщики, это сколько за объявление они получают? Можно привести цифры?;;2;;comment;;21930.0;
2020-05-13 13:50:08;21939;Это отчет муниципального депутата. Отказался от служебного авто, сделав из него такси для нуждающихся. Полезно посмотреть про борьбу с уплотнительной застройкой и юр. помощь. Едро на подобное не способно. Они могут лишь потратить деньги избирателей с видов, как будто бы это их. Почему оппозиция лучше чем Ядро. Когда народ поймет что от власти надо выгрызать свои права и менять воров. (эт был ряд оценочных суждений) https://www.youtube.com/watch?time_continue=869&v=SXlo6z9RM9g&feature=emb_logo;;1;;comment;;21930.0;
2020-05-16 00:31:23;21950;[id210281807|Mihail],;;0;;reply;;21930.0;21939
2020-05-13 13:52:49;21940;А что фамилию подписчика убрали? хотела спросить, он сам что-нибудь сделал, чтобы помочь соседям?;;3;;comment;;21930.0;
2020-05-14 07:12:36;21943;[id1622246|Наталья], была просьба опубликовать анонимно;;0;;reply;;21930.0;21940
2020-05-14 07:51:12;21947;[club189579374|Гражданка Общественный Совет], ясно, мужчинка трусом оказался. Судом грозить только из анонима и может;;1;;reply;;21930.0;21940
2020-05-19 17:05:08;21961;[id1622246|Наталья], почему вы так уверены в половом факторе?;;0;;reply;;21930.0;21940
2020-05-19 17:19:04;21963;[club189579374|Гражданка Общественный Совет], видела подпись, когда вы только опубликовали. Фамилию не запомнила, но помню, что мужчина. Ну, если только это не женщина с мужским именем.;;0;;reply;;21930.0;21940
2020-05-13 17:37:51;21942;"Ложь со стороны, тех кто присвоил себе наименование ""партии власти"" давно никого не удивляет. Из 20 депутатов Муниципального совета Гражданка - 19 работают на освобождённой основе. Это означает без заработной платы. Каждый из них, кроме работы депутата ещё и трудится на предприятиях и в организациях, как обычные работники.

Что касается ""компенсационных выплат на покрытие расходов связанных с деятельностью депутата"", то в 2020 году эти выплаты составляют 1400 (одна тысяча четыреста) рублей в месяц.

Кроме расклейки объявления (которые депутаты изготовили за свои средства, а не за средства бюджета Муниципального образования) каждый ведёт и другую работу в округе. Например работают с обращениями граждан.

Кстати, несмотря на ""удалёнку"" никто из депутатов приём обращений от жителей не отменял. 

Остановлены только личные приёмы, но любой житель может обратиться письменно, в том числе через социальные сети.";;5;;comment;;21930.0;
2020-05-14 07:17:06;21944;[id6822053|Вадим], возможно написавший пост не совсем хорошо представляет систему работы мундепа, а сложившееся народное мнение о депутатах сами знаете🤣🤣🤣;;1;;reply;;21930.0;21942
2020-05-11 11:35:13;21927;А где условия тендера? Может за ними постоянно следить надо?;;0;;comment;;21926.0;
2020-05-11 15:04:46;21928;[id210281807|Mihail], все можно почитать на сайте госзакупок.;;0;;reply;;21926.0;21927
2020-05-13 11:34:04;21937;То ли дело с лопаты блинами кормить;;0;;comment;;21926.0;
2020-05-06 12:42:04;21910;Маршируют в масках - это правильно;;2;;comment;;21909.0;
2020-05-06 14:07:54;21911;[id3374040|Артем], причем в чёрных;;0;;reply;;21909.0;21910
2020-05-06 16:09:39;21912;Жаль нет видео..;;0;;comment;;21909.0;
2020-05-06 19:52:50;21915;[id8235847|Елена], есть и видео.;;1;;reply;;21909.0;21912
2020-05-06 19:58:15;21916;[id517735597|Елена], а где? Посмотреть));;0;;reply;;21909.0;21912
2020-05-06 20:18:40;21918;"[id8235847|Елена], если друзьям удастся убрать с записи пение моей души, то обязательно выложу.
К сожалению повторить  сие, уже невозможно, оттого оно ещё и  печальнее, что слёзы и сильная дрожь в голосе испортили такой исторически -  знаменательный момент. Можно даже сказать  -  документ.
Ещё никогда День Победы не праздновался в масках и будем верить, что более такое не повторится.";;2;;reply;;21909.0;21912
2020-05-06 16:14:24;21913;Где инструменты, на чём играют 🤔;;0;;comment;;21909.0;
2020-05-06 19:59:26;21917;[id554772309|Игорь], до первого подъезда дома напротив, для съёмок мыльницей, далековато, поэтому плохо видно. А инструменты обычные для военного оркестра.;;2;;reply;;21909.0;21913
2020-05-04 06:53:07;21864;На лицо отличная воспитательная работа общественного совета.;;1;;comment;;21863.0;
2020-05-04 06:57:44;21865;[id1680001|Павел], общественный совет сила!!! Вот пример как в США на прошлой неделе общество решило вопрос со снятием карантина;;1;;reply;;21863.0;21864
2020-05-07 17:31:27;21919;Люди пришли обсудить проблему. В чем проблема то? Там они могут решить что-то. Их голос услышат. У людей кончились деньги и они пришли это донести до властей, которые имеют обратную связь с народом. Ну а вот та в России.... Чуть раньше. Швыряли камни.... https://www.youtube.com/watch?time_continue=35&v=jHLL3xggnSY&feature=emb_logo;;0;;comment;;21863.0;
2020-05-01 10:00:40;21836;А тем у кого 5ый этаж в 22ух этажке без балкона? На крыше - нее вариант. Я Вам подскажу решение. Закадываь в проекты кондиционеры. Но это ж так сложно и дорого! Как и инфрастркутура при строительстве человейников. Ну и где ЕДро со своиими заонодательствами?;;2;;comment;;21835.0;
2020-05-01 10:21:29;21837;[id210281807|Mihail], да это самый правильный путь, как и в санузлах делать аварийные сливы, но увы... Просто надо перестать строить без лоджии балкона и тогда и голову ни кому ломать не придется;;0;;reply;;21835.0;21836
2020-05-01 10:27:52;21841;На первых этажах не делают балконов сейчас, да и до 5-го тоже.... Видимо есть причины. Посмотрите на Академпарк. У нас 4ый, трешка, балконов нет. 2 кондея..... И?;;0;;reply;;21835.0;21836
2020-05-01 10:28:09;21842;На первых этажах не делают балконов сейчас, да и до 5-го тоже.... Видимо есть причины. Посмотрите на Академпарк. У нас 4ый, трешка, балконов нет. 2 кондея..... И?;;0;;reply;;21835.0;21836
2020-05-01 10:41:27;21844;[id210281807|Mihail], значит в соответствии с правилами  вешает на внутреннюю часть фасада, здесь посыл тем кто вешает кондиционеры на фасад имея лоджии и балконы;;0;;reply;;21835.0;21836
2020-05-01 10:45:49;21845;[id1908905|Владимир], А если однушка на юг выходит и на дорогу? Как напр. у меня на Блюхера. И балкона нет?;;1;;reply;;21835.0;21836
2020-05-01 11:06:15;21847;[id210281807|Mihail], а отвод можно сделать?;;0;;reply;;21835.0;21836
2020-05-01 11:07:24;21849;Внизу кусты. Это никому не мешает. Но блок наружний на проезжую часть.;;1;;reply;;21835.0;21836
2020-05-01 13:11:15;21851;[id210281807|Mihail], очень сильно мешает жителям нижних этажей, постоянная капель по железному отливу;;0;;reply;;21835.0;21836
2020-05-02 18:52:42;21858;"Ну да, других-то проблем в раисянии нет, чтобы ""светлое будущее"" феодального недогосударства связывать с размещением кондеев.";;0;;comment;;21835.0;
2020-05-03 16:33:21;21860;[id399382807|Анастасия], кондиционеры в СПб к сожалению в 90 процентов размещены с нарушениями, и многие представляют опасность для пешеходов, так как размещены над пешеходными зонами, и это серьезно. Надо начинать и с этого в том числе, а насчет феодального недогосударства я с вами не соглашусь, да есть перегибы, например конституцию меняют, но не трогают некоторые главы более значимые. Но в любом случае это первый шажок на выход от зависимости наших зарубежных товарищей.;;0;;reply;;21835.0;21858
2020-05-04 08:30:50;21868;[id1908905|Владимир], хосподя, какая же лютая чушь🤦‍♀️;;0;;reply;;21835.0;21858
2020-05-05 18:48:40;21907;Достаточно красить в цвет стены;;1;;comment;;21835.0;
2020-04-30 17:54:42;21830;"Здравствуйте. 
Мой папа, самоизолируется вместе со мной, в другом районе.  Где и когда он может получить медаль?(Карпинского 29).
Спасибо.";;0;;comment;;21829.0;
2020-04-30 18:06:44;21831;[id133428319|Елена], ехать никуда не надо, медаль можно получить в МО Гражданка, предварительно позвоните.;;0;;reply;;21829.0;21830
2020-04-30 18:19:44;21832;"После праздников?
Неизвестно, когда ""взрослым"" людям разрешат на улицу выходить?";;0;;reply;;21829.0;21830
2020-04-30 20:11:50;21833;Стесняюсь спросить..... Поздравления приготовлены для какой категории граждан? Т.с. в чем критерий? Родившимся до .... Э, окончания второй Мировой ? Тем кто принимал участие в боевых действиях (имеется военник) или?;;1;;comment;;21829.0;
2020-05-01 10:22:58;21838;[id210281807|Mihail], труженикам тыла, блокадникам, ветеранам, жителям блокадного Ленинграда, и плюс ещё есть категория участвующих разминировании и прочем.;;0;;reply;;21829.0;21833
2020-05-01 10:25:08;21840;Количество поздравительных наборов (назовем это так) какое? Прядок цифр....;;0;;reply;;21829.0;21833
2020-05-01 10:39:43;21843;[id210281807|Mihail], на каждого по набору, цифра несколькими тысячами исчисляется;;0;;reply;;21829.0;21833
2020-05-01 10:55:14;21846;На один МО?;;0;;reply;;21829.0;21833
2020-05-01 11:06:54;21848;[id210281807|Mihail], да по моему на Гражданку закупали около 4000 подарков;;0;;reply;;21829.0;21833
2020-05-01 11:08:26;21850;So.. Если это труженник.... То лет с 12 полагаю можно такими вещам заниматься?;;0;;reply;;21829.0;21833
2020-05-01 13:12:28;21852;[id210281807|Mihail], если даже родилься в период блокады или жил 1 день награда полагается;;0;;reply;;21829.0;21833
2020-05-01 13:14:02;21853;[id210281807|Mihail], там ещё выплаты из бюджета, в зависимости от категории до 75 тысяч;;0;;reply;;21829.0;21833
2020-05-01 13:58:42;21854;Можно ссылку на табличку по категориям и суммы выплат?;;0;;reply;;21829.0;21833
2020-05-01 18:44:46;21855;[id210281807|Mihail], загуглите или на сайте правительства СПб посмотрите там все есть (у меня под рукой нет а так бы вы с радостью выложил, но где то я про же им выплаты писал);;0;;reply;;21829.0;21833
2020-05-01 18:56:05;21856;https://yandex.ru/turbo?text=https%3A%2F%2Fwww.metronews.ru%2Fnovosti%2Fpeterbourg%2Freviews%2Fpeterburgskie-veterany-nachali-poluchat-vyplaty-k-75-letiyu-pobedy-1664897%2F Это?;;0;;reply;;21829.0;21833
2020-05-02 00:33:44;21857;[id210281807|Mihail], это из бюджета СПб, ещё есть ветеранам 75 и жбл 50 из федерального;;0;;reply;;21829.0;21833
2020-04-30 20:15:49;21834;Смакотин нагло украл голоса на выборах, а теперь календари со Сталиным дарит.;;4;;comment;;21829.0;
2020-05-01 10:24:01;21839;[id4386035|Руслан], и он ещё по 3 раза на неделе дезинфицируют информационные стенды на детских площадках)))) насчёт украл есть факты;;1;;reply;;21829.0;21834
2020-05-04 07:09:48;21866;[id4386035|Руслан], расскажите про кражу голосов поподробнее, что и как было?;;1;;reply;;21829.0;21834
2020-05-04 07:45:17;21867;я забыл поставить знак вопроса? насчет украл есть факты?;;0;;reply;;21829.0;21834
2020-05-04 15:03:19;21869;[id399775516|Олег], все, кто интересуется, знает как работала ИКМО, и избирательные комиссии. Вначале намеренно и незаконно не регистрировали кандидатов, потом делали регулярные подлоги. К чему притворяться?;;0;;reply;;21829.0;21834
2020-05-04 15:14:53;21870;;;0;;reply;;21829.0;21834
2020-05-04 15:16:46;21871;[id1908905|Владимир], а слабо погуглить? Видео с доказательствами настолько очевидные, что дальше некуда. Я приложил только лишь парочку, но трэш продолжился до самого конца.;;0;;reply;;21829.0;21834
2020-05-04 15:44:42;21872;[id4386035|Руслан], все кто интересуется знает что ИКМО зарегистрировала всех желающих стать кандидатами и представившими требуемые документы даже за пределами сроков, установленных законом. Про какие «потом делали регулярные подлоги» вообще не понятно, так как после регистрации  кандидатов никаких процедур с документами практически не производится. На видео события ИЮНЯ 2019, где группа мелких скандалистов требуют их пустить без очереди, наверное на основании того что один из них - Шуршев, гомосексуалист и близкий друг депутата-травокура Резника. А выборы проходили в СЕНТЯБРЕ и нет никаких, даже близко, намёков на то, что кто-то украл чьи-то голоса. Я же во всех этих событиях никак не фигурирую. И для Вашего сведения избирался в другом избирательном округе. Так что, Руслан, Вы очередной интернет-балабол, если не сказать более грубо.;;1;;reply;;21829.0;21834
2020-05-04 16:15:39;21873;"[id399775516|Олег], в число мелких скандалистов включили даже зам. председателя городской избирательной комиссии? Слишком очевидно, что этот карманный ИКМО не выборы проводил, а рисовал, то, что заказано. Ваши аргументы, это безосновательные или неотносимые к существу дела обвинения. Вас тоже гомиком многие считают. И какое это отношение имеет к выборам? Я уже не говорю о том правда это или ложь. А по ""выборам"" есть слишком много фактов. Это похоже на грабеж среди бела дня, просто у всех на глазах нарушили все правила и законы, и записали своих депутатов.";;0;;reply;;21829.0;21834
2020-05-04 16:19:40;21874;[id4386035|Руслан], здесь фальсификации нет, на видео не понятно что хотят, например в МО Гражданка первые несколько дней так же не было информации на стендах но потом она потихоньку появилась, и так она стандартная то я не использовал формы ИКМО все брал из ФЗ 67 и закона СПб о выборах, поэтому вообще не понимаю требования на видео, ведь господин Шуршев весьма подготовленный товарищ и смысл было тратить время на эти походы? Надо было сразу приносить первый пакет.;;0;;reply;;21829.0;21834
2020-05-04 16:24:17;21875;[id1908905|Владимир], ты почти ничего не знаешь, что там происходило. ИКМО скрывало начало приёма документов, долго скрывалось, и принимало документы только от Смакотинских. Но это было только начало. В конце просто нарисовали нужные итоги, все ресурсы, менты, суды и прочее, сказали что чёрное это белое. Но фактов слишком много, они очевидны. Нелепо отрицать, разве что в расчёте на тех, кто не изучил вопрос. Изучи подробнее, многое поймёшь!;;1;;reply;;21829.0;21834
2020-05-04 16:45:08;21876;[id4386035|Руслан], я по МО Гражданка специализировался))) но чуть чуть не хватило;;0;;reply;;21829.0;21834
2020-05-04 16:55:34;21877;"так посмотри видеоматериалы и документы, в т.ч. судебные и полицейские. Их много. Я отсмотрел десятки часов видео, и множество документов. Совершенно очевидно неприкрытое рисование голосов, т.е. это были и не выборы вовсе, а наглый обман, грабёж избирателей. Смакотин это всё прекрасно знает, просто он считает это целесообразным, ибо негоже ""травокурам и геям"", он лучше знает, как бюджет ""пилить"", и вообще он святой.";;0;;reply;;21829.0;21834
